{
  "schema": "promptbranch.orchestration.grill",
  "schema_version": "1.0",
  "stage": "G1_mvp",
  "project": {
    "id": "k8s-game-mvp",
    "role": "orchestration-model-test-vehicle"
  },
  "provider": {
    "kind": "chatgpt",
    "critical_path": true,
    "note": "manual_fixture is allowed only for committed read-only examples; production critical-path grilling remains ChatGPT-only."
  },
  "proposal_status": "proposal_only",
  "constraints": {
    "model_may_execute": false,
    "promptbranch_must_validate": true,
    "source_mutation_allowed": false,
    "artifact_adoption_allowed": false
  },
  "questions": [
    {
      "id": "G1_mvp_Q1",
      "question": "What is the smallest testable MVP slice that proves the orchestration flow?",
      "risk": "oversized_mvp",
      "required_evidence": [
        "validated_json",
        "operator_review"
      ]
    }
  ],
  "acceptance": {
    "blocking_findings": [],
    "decision": "continue"
  },
  "next_state_recommendation": {
    "from": "intake_accepted",
    "to": "grill_me_accepted",
    "reason": "MVP grill may recommend the constrained MVP shape; the recommendation remains proposal-only until Promptbranch validates and records an accepted event."
  }
}
