{
  "schema": "promptbranch.orchestration.grill",
  "schema_version": "1.0",
  "stage": "G5_release_deployment",
  "project": {
    "id": "k8s-game-mvp",
    "role": "orchestration-model-test-vehicle"
  },
  "provider": {
    "kind": "manual_fixture",
    "critical_path": false,
    "note": "manual_fixture is allowed only for committed read-only examples; production critical-path grilling remains ChatGPT-only."
  },
  "proposal_status": "proposal_only",
  "constraints": {
    "model_may_execute": false,
    "promptbranch_must_validate": true,
    "source_mutation_allowed": false,
    "artifact_adoption_allowed": false
  },
  "questions": [
    {
      "id": "G5_release_deployment_Q1",
      "question": "Which evidence proves package, release, and deployment state without trusting model prose?",
      "risk": "unverified_release",
      "required_evidence": [
        "validated_json",
        "operator_review"
      ]
    }
  ],
  "acceptance": {
    "blocking_findings": [],
    "decision": "continue"
  },
  "next_state_recommendation": {
    "from": "implementation_candidate",
    "to": "artifact_verified",
    "reason": "Release/deployment grill may recommend the next evidence target, but artifact verification and deployment remain external evidence-producing gates."
  }
}
